reference_id,title,url,reference_type,accessed_at,notes
gesis_za9076,Social Media Accounts of Candidates from the German Federal Election 2025 (ZA9076),https://search.gesis.org/research_data/ZA9076,research_dataset,2026-07-18,"IDs and URLs of public X, TikTok, Facebook, Instagram and Bluesky accounts plus personal websites."
gesis_release,GESIS data release notice for ZA9076,https://www.gesis.org/en/gles/news-details/article/datenveroeffentlichung-social-media-konten-der-deutschen-kandidierenden-bei-der-bundestagswahl-2025-za9076-version-100-ist-verfuegbar,method_reference,2026-07-18,
bundesregierung_cabinet,Federal Cabinet overview,https://www.bundesregierung.de/breg-de/bundesregierung/bundeskabinett,official_role_reference,2026-07-18,
bsw_social,BSW Impressum and official social profiles,https://bsw-vg.de/impressum/,official_account_reference,2026-07-18,
linke_social,Die Linke official account list,https://www.die-linke.de/fileadmin/user_upload/Antragsheft_3_neu.pdf,official_account_reference,2026-07-18,
belarus_social,Belarus MFA official social media list,https://mfa.gov.by/en/press/socialmedia/,official_account_reference,2026-07-18,
mard_handoff,"Magic Paws / MARD-HAT comprehensive handoff, 2026-07-16",MAGICPAWS_MARD_HAT_COMPREHENSIVE_HANDOFF_2026-07-16.md,local_system_reference,2026-07-18,MARD-HAT remains contextual telemetry and not attribution-grade.
